[
 {
  "archive_id": null,
  "archive_url": null,
  "document_date": "2026-02-19",
  "id": "src-contracts-audit-2026",
  "issuer": "City of Berkeley, City Auditor",
  "kind": "audit_report",
  "note": "Presented to the City Council as Consent Calendar Item 6 on March 10, 2026. Page locators are pages of this PDF, which the City stamps \"Page N of 45\".",
  "official_url": "https://berkeleyca.gov/sites/default/files/2026-02/2026-03-10%20Item%2006%20City%20Contracts%20Outdated%20Process%20Led%20to%20Non-Competitive.pdf",
  "retrieved": "2026-10-28",
  "sha256": "b8cf23338bc73b58cdc65e8d306c30dc15c246b81edec46dc0fa1ec9b7c77208",
  "title": "City Contracts: Outdated Process Led to Non-Competitive Contracts"
 },
 {
  "archive_id": "bcc-2026-03-10-regular-annotated-agenda",
  "archive_url": "https://github.com/ericdf/berkeley-public-records/blob/7a22d845c6f0f8476f21d19f0d261500be4333c7/L0/annotated-agendas/bcc-2026-03-10-regular-annotated-agenda.pdf",
  "document_date": "2026-03-10",
  "id": "src-bcc-2026-03-10-annotated-agenda",
  "issuer": "City of Berkeley, City Clerk Department",
  "kind": "annotated_agenda",
  "note": null,
  "official_url": "https://berkeleyca.gov/sites/default/files/city-council-meetings/2026-03-10%20Annotated%20Agenda%20-%20Council.pdf",
  "retrieved": "2026-10-28",
  "sha256": "354f9f15f290accd79a48547502c593bb799143802af1dac59d6547cefc5dfcf",
  "title": "Annotated Agenda, Berkeley City Council regular meeting, March 10, 2026"
 },
 {
  "archive_id": "audits-audit-plan-fy2027",
  "archive_url": "https://github.com/ericdf/berkeley-public-records/blob/7a22d845c6f0f8476f21d19f0d261500be4333c7/L0/sources/audits/audits-audit-plan-fy2027.pdf",
  "document_date": "2026-06-30",
  "id": "src-auditor-plan-fy2027",
  "issuer": "City of Berkeley, City Auditor",
  "kind": "audit_plan",
  "note": "The plan prints no date. It was Information Report Item 50 at the City Council meeting of June 30, 2026.",
  "official_url": "https://berkeleyca.gov/sites/default/files/2026-05/City_Auditor_Fiscal_Year_2027_Audit_Plan.pdf",
  "retrieved": null,
  "sha256": "b1828483d850a8637f683e5ca55c92118bb4df12d71fa84d2f88370333a1ce8f",
  "title": "City Auditor Fiscal Year 2027 Audit Plan"
 },
 {
  "archive_id": "bcc-2026-06-30-regular-annotated-agenda",
  "archive_url": "https://github.com/ericdf/berkeley-public-records/blob/7a22d845c6f0f8476f21d19f0d261500be4333c7/L0/annotated-agendas/bcc-2026-06-30-regular-annotated-agenda.pdf",
  "document_date": "2026-06-30",
  "id": "src-bcc-2026-06-30-annotated-agenda",
  "issuer": "City of Berkeley, City Clerk Department",
  "kind": "annotated_agenda",
  "note": null,
  "official_url": "https://berkeleyca.gov/sites/default/files/city-council-meetings/2026-06-30%20Annotated%20Agenda%20-%20Council.pdf",
  "retrieved": "2026-09-29",
  "sha256": "e351f317c54d69cef4291f2762c203d5b99353e0b94059887b76f24ee10e09e1",
  "title": "Annotated Agenda, Berkeley City Council regular meeting, June 30, 2026"
 },
 {
  "archive_id": "bcc-2024-01-16-regular-annotated-agenda",
  "archive_url": "https://github.com/ericdf/berkeley-public-records/blob/7a22d845c6f0f8476f21d19f0d261500be4333c7/L0/annotated-agendas/bcc-2024-01-16-regular-annotated-agenda.pdf",
  "document_date": "2024-01-16",
  "id": "src-bcc-2024-01-16-regular-annotated-agenda",
  "issuer": "City of Berkeley, City Clerk Department",
  "kind": "annotated_agenda",
  "note": null,
  "official_url": "https://berkeleyca.gov/sites/default/files/city-council-meetings/2024-01-16%20Annotated%20Agenda%20-%20Council_1.pdf",
  "retrieved": "2026-10-24",
  "sha256": "9ae2d62ab5648195564a7db8cbba9eefffd8a3dd5fdcf000677b4996fcc7cc75",
  "title": "Annotated Agenda — Berkeley City Council regular meeting, 2024-01-16"
 },
 {
  "archive_id": "bcc-2024-02-13-regular-annotated-agenda",
  "archive_url": "https://github.com/ericdf/berkeley-public-records/blob/7a22d845c6f0f8476f21d19f0d261500be4333c7/L0/annotated-agendas/bcc-2024-02-13-regular-annotated-agenda.pdf",
  "document_date": "2024-02-13",
  "id": "src-bcc-2024-02-13-regular-annotated-agenda",
  "issuer": "City of Berkeley, City Clerk Department",
  "kind": "annotated_agenda",
  "note": null,
  "official_url": "https://berkeleyca.gov/sites/default/files/city-council-meetings/2024-02-13%20Annotated%20Agenda%20-%20Council.pdf",
  "retrieved": "2026-10-24",
  "sha256": "90b6a4beb68e3dbe2e6c6a184aaf259cebea896f261c75af28aca839a98764ef",
  "title": "Annotated Agenda — Berkeley City Council regular meeting, 2024-02-13"
 },
 {
  "archive_id": "bcc-2024-02-27-regular-annotated-agenda",
  "archive_url": "https://github.com/ericdf/berkeley-public-records/blob/7a22d845c6f0f8476f21d19f0d261500be4333c7/L0/annotated-agendas/bcc-2024-02-27-regular-annotated-agenda.pdf",
  "document_date": "2024-02-27",
  "id": "src-bcc-2024-02-27-regular-annotated-agenda",
  "issuer": "City of Berkeley, City Clerk Department",
  "kind": "annotated_agenda",
  "note": null,
  "official_url": "https://berkeleyca.gov/sites/default/files/city-council-meetings/2024-02-27%20Annotated%20Agenda%20-%20Council.pdf",
  "retrieved": "2026-10-24",
  "sha256": "334d656acd9514920aa9a54863766e9728f34ded4cdc8025076370d61b90bf23",
  "title": "Annotated Agenda — Berkeley City Council regular meeting, 2024-02-27"
 },
 {
  "archive_id": "bcc-2024-03-26-regular-annotated-agenda",
  "archive_url": "https://github.com/ericdf/berkeley-public-records/blob/7a22d845c6f0f8476f21d19f0d261500be4333c7/L0/annotated-agendas/bcc-2024-03-26-regular-annotated-agenda.pdf",
  "document_date": "2024-03-26",
  "id": "src-bcc-2024-03-26-regular-annotated-agenda",
  "issuer": "City of Berkeley, City Clerk Department",
  "kind": "annotated_agenda",
  "note": null,
  "official_url": "https://berkeleyca.gov/sites/default/files/city-council-meetings/2024-03-26%20Annotated%20Agenda%20-%20Council_0.pdf",
  "retrieved": "2026-10-24",
  "sha256": "6560f24e518f0dc92d951538e28bf92655493ecb6012aaaefd1bf8f0fff74cc9",
  "title": "Annotated Agenda — Berkeley City Council regular meeting, 2024-03-26"
 },
 {
  "archive_id": "bcc-2024-05-07-regular-annotated-agenda",
  "archive_url": "https://github.com/ericdf/berkeley-public-records/blob/7a22d845c6f0f8476f21d19f0d261500be4333c7/L0/annotated-agendas/bcc-2024-05-07-regular-annotated-agenda.pdf",
  "document_date": "2024-05-07",
  "id": "src-bcc-2024-05-07-regular-annotated-agenda",
  "issuer": "City of Berkeley, City Clerk Department",
  "kind": "annotated_agenda",
  "note": null,
  "official_url": "https://berkeleyca.gov/sites/default/files/city-council-meetings/2024-05-07%20Annotated%20Agenda%20-%20Council.pdf",
  "retrieved": "2026-10-24",
  "sha256": "8e22c9e6a6b6e7846c934489b8eff6af4a4b221e7df779a5e43647df9ac1dcc9",
  "title": "Annotated Agenda — Berkeley City Council regular meeting, 2024-05-07"
 },
 {
  "archive_id": "bcc-2024-05-14-regular-annotated-agenda",
  "archive_url": "https://github.com/ericdf/berkeley-public-records/blob/7a22d845c6f0f8476f21d19f0d261500be4333c7/L0/annotated-agendas/bcc-2024-05-14-regular-annotated-agenda.pdf",
  "document_date": "2024-05-14",
  "id": "src-bcc-2024-05-14-regular-annotated-agenda",
  "issuer": "City of Berkeley, City Clerk Department",
  "kind": "annotated_agenda",
  "note": null,
  "official_url": "https://berkeleyca.gov/sites/default/files/city-council-meetings/2024-05-14%20Annotated%20Agenda%20-%20Council.pdf",
  "retrieved": "2026-10-24",
  "sha256": "0d8e40a17b9412bc1b54c4d8b11629550f0222ab758601f0c4359789059538c0",
  "title": "Annotated Agenda — Berkeley City Council regular meeting, 2024-05-14"
 },
 {
  "archive_id": "bcc-2024-05-21-regular-annotated-agenda",
  "archive_url": "https://github.com/ericdf/berkeley-public-records/blob/7a22d845c6f0f8476f21d19f0d261500be4333c7/L0/annotated-agendas/bcc-2024-05-21-regular-annotated-agenda.pdf",
  "document_date": "2024-05-21",
  "id": "src-bcc-2024-05-21-regular-annotated-agenda",
  "issuer": "City of Berkeley, City Clerk Department",
  "kind": "annotated_agenda",
  "note": null,
  "official_url": "https://berkeleyca.gov/sites/default/files/city-council-meetings/2024-05-21%20Annotated%20Agenda%20-%20Council.pdf",
  "retrieved": "2026-10-24",
  "sha256": "0dbc8779086bd233929ec7414ada335e3c046ba92712914bbdb0ee5f3fc7930a",
  "title": "Annotated Agenda — Berkeley City Council regular meeting, 2024-05-21"
 },
 {
  "archive_id": "bcc-2024-06-25-regular-annotated-agenda",
  "archive_url": "https://github.com/ericdf/berkeley-public-records/blob/7a22d845c6f0f8476f21d19f0d261500be4333c7/L0/annotated-agendas/bcc-2024-06-25-regular-annotated-agenda.pdf",
  "document_date": "2024-06-25",
  "id": "src-bcc-2024-06-25-regular-annotated-agenda",
  "issuer": "City of Berkeley, City Clerk Department",
  "kind": "annotated_agenda",
  "note": null,
  "official_url": "https://berkeleyca.gov/sites/default/files/city-council-meetings/2024-06-25%20Annotated%20Agenda%20-%20Council.pdf",
  "retrieved": "2026-10-24",
  "sha256": "411548886fd91b3283e3a8f0ff2ba8406345e9049d265e92927e0809d62546ee",
  "title": "Annotated Agenda — Berkeley City Council regular meeting, 2024-06-25"
 },
 {
  "archive_id": "bcc-2024-07-09-regular-annotated-agenda",
  "archive_url": "https://github.com/ericdf/berkeley-public-records/blob/7a22d845c6f0f8476f21d19f0d261500be4333c7/L0/annotated-agendas/bcc-2024-07-09-regular-annotated-agenda.pdf",
  "document_date": "2024-07-09",
  "id": "src-bcc-2024-07-09-regular-annotated-agenda",
  "issuer": "City of Berkeley, City Clerk Department",
  "kind": "annotated_agenda",
  "note": null,
  "official_url": "https://berkeleyca.gov/sites/default/files/city-council-meetings/2024-07-09%20Annotated%20Agenda%20-%20Council.pdf",
  "retrieved": "2026-10-24",
  "sha256": "3fcdf72cbf56818dc65e40cb21ef0b18b814197e946b508a458e4dac74a2101d",
  "title": "Annotated Agenda — Berkeley City Council regular meeting, 2024-07-09"
 },
 {
  "archive_id": "bcc-2024-07-30-regular-annotated-agenda",